{"byFamily":{"broad_concentration":{"inventoryUnavailableQueryCount":0,"judgedQueryCount":1,"metrics":{"hitAt1":{"evaluatedQueries":0,"value":null},"hitAt3":{"evaluatedQueries":0,"value":null},"mrr":{"evaluatedQueries":0,"value":null},"ndcgAt5":{"evaluatedQueries":1,"value":0},"precisionAt5":{"evaluatedQueries":1,"value":0},"recallAt20":{"evaluatedQueries":1,"value":0}},"queryCount":4,"recallAt50":{"evaluatedQueries":0,"status":"NOT_REQUIRED","value":null},"status":"EVALUATED","zeroResultCount":1,"zeroResultRate":1},"broad_discovery":{"inventoryUnavailableQueryCount":0,"judgedQueryCount":2,"metrics":{"hitAt1":{"evaluatedQueries":0,"value":null},"hitAt3":{"evaluatedQueries":0,"value":null},"mrr":{"evaluatedQueries":0,"value":null},"ndcgAt5":{"evaluatedQueries":2,"value":0.20803518926146267},"precisionAt5":{"evaluatedQueries":2,"value":0.1},"recallAt20":{"evaluatedQueries":2,"value":0.08333333333333333}},"queryCount":4,"recallAt50":{"evaluatedQueries":0,"status":"NOT_REQUIRED","value":null},"status":"EVALUATED","zeroResultCount":1,"zeroResultRate":0.5},"canonical_exact_same_name":{"inventoryUnavailableQueryCount":2,"judgedQueryCount":2,"metrics":{"hitAt1":{"evaluatedQueries":0,"value":null},"hitAt3":{"evaluatedQueries":0,"value":null},"mrr":{"evaluatedQueries":0,"value":null},"ndcgAt5":{"evaluatedQueries":0,"value":null},"precisionAt5":{"evaluatedQueries":0,"value":null},"recallAt20":{"evaluatedQueries":0,"value":null}},"queryCount":5,"recallAt50":{"evaluatedQueries":0,"status":"NOT_REQUIRED","value":null},"status":"EVALUATED","zeroResultCount":2,"zeroResultRate":1},"event_time":{"inventoryUnavailableQueryCount":0,"judgedQueryCount":0,"metrics":{"hitAt1":{"evaluatedQueries":0,"value":null},"hitAt3":{"evaluatedQueries":0,"value":null},"mrr":{"evaluatedQueries":0,"value":null},"ndcgAt5":{"evaluatedQueries":0,"value":null},"precisionAt5":{"evaluatedQueries":0,"value":null},"recallAt20":{"evaluatedQueries":0,"value":null}},"queryCount":6,"recallAt50":{"evaluatedQueries":0,"status":"NOT_REQUIRED","value":null},"status":"NOT_EVALUATED","zeroResultCount":0,"zeroResultRate":null},"geo_scope_radius":{"inventoryUnavailableQueryCount":0,"judgedQueryCount":1,"metrics":{"hitAt1":{"evaluatedQueries":0,"value":null},"hitAt3":{"evaluatedQueries":0,"value":null},"mrr":{"evaluatedQueries":0,"value":null},"ndcgAt5":{"evaluatedQueries":1,"value":0},"precisionAt5":{"evaluatedQueries":1,"value":0},"recallAt20":{"evaluatedQueries":1,"value":0}},"queryCount":3,"recallAt50":{"evaluatedQueries":0,"status":"NOT_REQUIRED","value":null},"status":"EVALUATED","zeroResultCount":1,"zeroResultRate":1},"prefix":{"inventoryUnavailableQueryCount":1,"judgedQueryCount":1,"metrics":{"hitAt1":{"evaluatedQueries":0,"value":null},"hitAt3":{"evaluatedQueries":0,"value":null},"mrr":{"evaluatedQueries":0,"value":null},"ndcgAt5":{"evaluatedQueries":0,"value":null},"precisionAt5":{"evaluatedQueries":0,"value":null},"recallAt20":{"evaluatedQueries":0,"value":null}},"queryCount":4,"recallAt50":{"evaluatedQueries":0,"status":"NOT_REQUIRED","value":null},"status":"EVALUATED","zeroResultCount":1,"zeroResultRate":1},"scarcity_duplicate_state":{"inventoryUnavailableQueryCount":0,"judgedQueryCount":1,"metrics":{"hitAt1":{"evaluatedQueries":0,"value":null},"hitAt3":{"evaluatedQueries":0,"value":null},"mrr":{"evaluatedQueries":0,"value":null},"ndcgAt5":{"evaluatedQueries":0,"value":null},"precisionAt5":{"evaluatedQueries":0,"value":null},"recallAt20":{"evaluatedQueries":0,"value":null}},"queryCount":3,"recallAt50":{"evaluatedQueries":0,"status":"NOT_REQUIRED","value":null},"status":"EVALUATED","zeroResultCount":1,"zeroResultRate":1},"semantic_occasion_language":{"inventoryUnavailableQueryCount":0,"judgedQueryCount":0,"metrics":{"hitAt1":{"evaluatedQueries":0,"value":null},"hitAt3":{"evaluatedQueries":0,"value":null},"mrr":{"evaluatedQueries":0,"value":null},"ndcgAt5":{"evaluatedQueries":0,"value":null},"precisionAt5":{"evaluatedQueries":0,"value":null},"recallAt20":{"evaluatedQueries":0,"value":null}},"queryCount":16,"recallAt50":{"evaluatedQueries":0,"status":"NOT_REQUIRED","value":null},"status":"NOT_EVALUATED","zeroResultCount":0,"zeroResultRate":null},"taxonomy_parent_leaf":{"inventoryUnavailableQueryCount":0,"judgedQueryCount":3,"metrics":{"hitAt1":{"evaluatedQueries":0,"value":null},"hitAt3":{"evaluatedQueries":0,"value":null},"mrr":{"evaluatedQueries":0,"value":null},"ndcgAt5":{"evaluatedQueries":1,"value":1},"precisionAt5":{"evaluatedQueries":1,"value":0.6},"recallAt20":{"evaluatedQueries":1,"value":1}},"queryCount":7,"recallAt50":{"evaluatedQueries":0,"status":"NOT_REQUIRED","value":null},"status":"EVALUATED","zeroResultCount":2,"zeroResultRate":0.6666666666666666},"typo_transposition_accent_spacing":{"inventoryUnavailableQueryCount":2,"judgedQueryCount":2,"metrics":{"hitAt1":{"evaluatedQueries":0,"value":null},"hitAt3":{"evaluatedQueries":0,"value":null},"mrr":{"evaluatedQueries":0,"value":null},"ndcgAt5":{"evaluatedQueries":0,"value":null},"precisionAt5":{"evaluatedQueries":0,"value":null},"recallAt20":{"evaluatedQueries":0,"value":null}},"queryCount":5,"recallAt50":{"evaluatedQueries":0,"status":"NOT_REQUIRED","value":null},"status":"EVALUATED","zeroResultCount":2,"zeroResultRate":1},"verified_colliding_aliases":{"inventoryUnavailableQueryCount":1,"judgedQueryCount":1,"metrics":{"hitAt1":{"evaluatedQueries":0,"value":null},"hitAt3":{"evaluatedQueries":0,"value":null},"mrr":{"evaluatedQueries":0,"value":null},"ndcgAt5":{"evaluatedQueries":0,"value":null},"precisionAt5":{"evaluatedQueries":0,"value":null},"recallAt20":{"evaluatedQueries":0,"value":null}},"queryCount":3,"recallAt50":{"evaluatedQueries":0,"status":"NOT_REQUIRED","value":null},"status":"EVALUATED","zeroResultCount":1,"zeroResultRate":1}},"byLanguage":{"en":{"inventoryUnavailableQueryCount":0,"judgedQueryCount":4,"metrics":{"hitAt1":{"evaluatedQueries":0,"value":null},"hitAt3":{"evaluatedQueries":0,"value":null},"mrr":{"evaluatedQueries":0,"value":null},"ndcgAt5":{"evaluatedQueries":2,"value":0.20803518926146267},"precisionAt5":{"evaluatedQueries":2,"value":0.1},"recallAt20":{"evaluatedQueries":2,"value":0.08333333333333333}},"queryCount":23,"recallAt50":{"evaluatedQueries":0,"status":"NOT_REQUIRED","value":null},"status":"EVALUATED","zeroResultCount":3,"zeroResultRate":0.75},"language-neutral":{"inventoryUnavailableQueryCount":2,"judgedQueryCount":2,"metrics":{"hitAt1":{"evaluatedQueries":0,"value":null},"hitAt3":{"evaluatedQueries":0,"value":null},"mrr":{"evaluatedQueries":0,"value":null},"ndcgAt5":{"evaluatedQueries":0,"value":null},"precisionAt5":{"evaluatedQueries":0,"value":null},"recallAt20":{"evaluatedQueries":0,"value":null}},"queryCount":4,"recallAt50":{"evaluatedQueries":0,"status":"NOT_REQUIRED","value":null},"status":"EVALUATED","zeroResultCount":2,"zeroResultRate":1},"mixed":{"inventoryUnavailableQueryCount":1,"judgedQueryCount":2,"metrics":{"hitAt1":{"evaluatedQueries":0,"value":null},"hitAt3":{"evaluatedQueries":0,"value":null},"mrr":{"evaluatedQueries":0,"value":null},"ndcgAt5":{"evaluatedQueries":0,"value":null},"precisionAt5":{"evaluatedQueries":0,"value":null},"recallAt20":{"evaluatedQueries":0,"value":null}},"queryCount":2,"recallAt50":{"evaluatedQueries":0,"status":"NOT_REQUIRED","value":null},"status":"EVALUATED","zeroResultCount":2,"zeroResultRate":1},"sv":{"inventoryUnavailableQueryCount":3,"judgedQueryCount":6,"metrics":{"hitAt1":{"evaluatedQueries":0,"value":null},"hitAt3":{"evaluatedQueries":0,"value":null},"mrr":{"evaluatedQueries":0,"value":null},"ndcgAt5":{"evaluatedQueries":3,"value":0.3333333333333333},"precisionAt5":{"evaluatedQueries":3,"value":0.19999999999999998},"recallAt20":{"evaluatedQueries":3,"value":0.3333333333333333}},"queryCount":31,"recallAt50":{"evaluatedQueries":0,"status":"NOT_REQUIRED","value":null},"status":"EVALUATED","zeroResultCount":5,"zeroResultRate":0.8333333333333334}},"capabilities":{"deterministic":"IMPLEMENTED","event":"NOT_IMPLEMENTED","nonCollapse":"NOT_IMPLEMENTED","rrf":"NOT_IMPLEMENTED","semantic":"NOT_IMPLEMENTED"},"contentChecksum":"bae1ad696df6d6a868e51254285444d109a55d3f4a7f8c0fa3d863daf3ef34f7","failureAttributionSummary":{"CANDIDATE_RETRIEVAL":4,"INVENTORY":6},"overall":{"inventoryUnavailableQueryCount":6,"judgedQueryCount":14,"metrics":{"hitAt1":{"evaluatedQueries":0,"value":null},"hitAt3":{"evaluatedQueries":0,"value":null},"mrr":{"evaluatedQueries":0,"value":null},"ndcgAt5":{"evaluatedQueries":5,"value":0.28321407570458507},"precisionAt5":{"evaluatedQueries":5,"value":0.16},"recallAt20":{"evaluatedQueries":5,"value":0.23333333333333334}},"queryCount":60,"recallAt50":{"evaluatedQueries":0,"status":"NOT_REQUIRED","value":null},"status":"EVALUATED","zeroResultCount":12,"zeroResultRate":0.8571428571428571},"pairs":[],"pins":{"boundary":{"checksum":"257a277667cde164bcb70eae16ca6985578fe34666df92ff289af519a262df1d","version":"lm-current-2026-08-14"},"corpus":{"checksum":"bc2da4670e68532fe9b66c700157c3647c3a73181d460f21b4e443980d23242c","version":"corpus.v1"},"dataset":{"checksum":"5ade651f358bafed92d51ac5b29651cbea5123958380263633e18385b5d730f0","codeGitCommit":"4f26f920ebcdc979b6b091bb13cbc5d3f20a852b","inventoryChecksum":"ef89e8fb98246b4418a2094addc861ee5a85e2e842a3409c0e5c761f4ab0a1f2","version":"dataset-manifest.day2.v1"},"evaluationClockUtc":"2026-10-15T12:00:00Z","judgments":{"checksum":"0b4df5f25445dd85749431c300ceb7a33670fa23c8cddb3213903f33a37c8b83","version":"judgments.day2.v1"},"model":{"status":"NOT_PARTICIPATING"},"searchConfigVersion":"embed-01a-preflight-v1","searchDocuments":{"documentVersion":"search-document-v1","hashes":["02c32feb07df3e54807353177b72327423e1678514faf30effec8b79220cf9bf","270608729dc73ae7dea6d334582369ebf7c01c4734caf98e36d76bafd47471d2","323a597895f39252f546821bab20936c9e2325e013285ccbc792b070bff461cc","533c142a416ccaaf8adb1d4c8f4479b6d6f7f618ccc65841a3e8e8d3ccf45ef7","9f824d589335d49c7c868950229104ad8d73a6eee09e5bdede08c58153ff56d2","baa57da6b4ac8a69b952d86ccac67470e2345ec733cb22100f97a90f80